{
  "$schema": "https://json-schema.org/draft/2020-12/schema",
  "title": "Software Grimoire Public Smoke Check",
  "type": "object",
  "required": ["generated_at", "site_dir", "live_url", "checks", "passed"],
  "properties": {
    "generated_at": {"type": "string", "minLength": 1},
    "site_dir": {"type": "string", "minLength": 1},
    "live_url": {"type": "string"},
    "passed": {"type": "boolean"},
    "checks": {
      "type": "array",
      "items": {
        "type": "object",
        "required": ["kind", "target", "passed"],
        "properties": {
          "kind": {"type": "string", "minLength": 1},
          "target": {"type": "string", "minLength": 1},
          "passed": {"type": "boolean"},
          "status": {"type": ["integer", "null"]},
          "sample": {"type": "string"}
        },
        "additionalProperties": false
      }
    }
  },
  "additionalProperties": false
}
