{
  "generated_at": "2026-07-02T19:53:37.131937+00:00",
  "site_dir": "_site",
  "live_url": "",
  "checks": [
    {
      "kind": "local_html",
      "target": "index.html",
      "passed": true
    },
    {
      "kind": "local_html",
      "target": "reference/evidence-browser.html",
      "passed": true
    },
    {
      "kind": "local_html",
      "target": "reference/calibration.html",
      "passed": true
    },
    {
      "kind": "local_html",
      "target": "reference/hardness-v4.html",
      "passed": true
    },
    {
      "kind": "local_html",
      "target": "reference/ward-science.html",
      "passed": true
    },
    {
      "kind": "local_html",
      "target": "reference/canon-review-queue.html",
      "passed": true
    },
    {
      "kind": "local_html",
      "target": "reference/methods-structure-reviewability-warding.html",
      "passed": true
    },
    {
      "kind": "local_html",
      "target": "reference/logical-conclusion-status.html",
      "passed": true
    },
    {
      "kind": "local_html",
      "target": "reference/package-index-release.html",
      "passed": true
    },
    {
      "kind": "local_html",
      "target": "examples/evaluations/index.html",
      "passed": true
    },
    {
      "kind": "local_html",
      "target": "examples/jailbreak-resilience/index.html",
      "passed": true
    },
    {
      "kind": "local_resource",
      "target": "data/evidence_taxonomy.json",
      "passed": true
    },
    {
      "kind": "local_resource",
      "target": "data/evidence_index.json",
      "passed": true
    },
    {
      "kind": "local_resource",
      "target": "data/logical_conclusion_status.json",
      "passed": true
    },
    {
      "kind": "local_resource",
      "target": "data/canon_review_queue.json",
      "passed": true
    },
    {
      "kind": "local_resource",
      "target": "examples/canon/canon-audit-decision-template.json",
      "passed": true
    },
    {
      "kind": "local_resource",
      "target": "examples/evaluations/model-execution-results.json",
      "passed": true
    },
    {
      "kind": "local_resource",
      "target": "examples/evaluations/hardness-v4/results.json",
      "passed": true
    },
    {
      "kind": "local_resource",
      "target": "examples/evaluations/hardness-v4/model-surface-results.json",
      "passed": true
    },
    {
      "kind": "local_resource",
      "target": "examples/evaluations/hardness-v4/manual-import-template.json",
      "passed": true
    },
    {
      "kind": "local_resource",
      "target": "examples/evaluations/hardness-v4/hardness-intake-decision-template.json",
      "passed": true
    },
    {
      "kind": "local_resource",
      "target": "examples/adoption/adoption-intake-decision-template.json",
      "passed": true
    },
    {
      "kind": "local_resource",
      "target": "examples/adoption/package-index-release-plan.json",
      "passed": true
    },
    {
      "kind": "local_resource",
      "target": "examples/adoption/package-index-smoke-template.json",
      "passed": true
    },
    {
      "kind": "local_resource",
      "target": "examples/jailbreak-resilience/ab-results.json",
      "passed": true
    },
    {
      "kind": "local_resource",
      "target": "examples/jailbreak-resilience/ward-science-results.json",
      "passed": true
    },
    {
      "kind": "local_resource",
      "target": "exports/library-manifest.json",
      "passed": true
    },
    {
      "kind": "local_resource",
      "target": "exports/checksums.sha256",
      "passed": true
    }
  ],
  "passed": true
}
